{
 "id": "ua8ae400a-5af72ede63cb219c",
 "school": "北京大学",
 "school_slug": "ua8ae400a",
 "unit": "研究生招生网",
 "board": " 硕士招生  博士招生  港澳台招生  留学生招生  夏令营  网上报名",
 "title": "27\"申请-考核制\"博士研究生推荐信线上提交流程",
 "publish_date": "2026-10-20",
 "url": "https://admission.pku.edu.cn/docs/20261020091156436628.pdf",
 "source": null,
 "body_text": "考生上传推荐信流程 \n1. 考生填写推荐人信息在报名系统中“专家推荐信”环节，考生按要求填写推荐专家的姓名、 工作单位、 邮箱等信息，确保信息的准确性和完整性。 \n注意： （1）考生在填写信息前，需要先与推荐专家沟通，征得推荐专家的同意和配合；\n（2）信息填写完毕后，考生须确认推荐专家姓名、单位和邮箱准确无误，若填写错误推荐专家将无法收到推荐信邀请邮件；（3）每个志愿须提交两封专家推荐信。 \n \n \n2. 系统发送填写推荐信邀请推荐专家信息填写完毕并确认无误后， 点击 “发送邮件” 按钮，报名系统将根据考生填写的信息， 自动向推荐专家邮箱发送邮件，邀请推荐专家填写并上传推荐信。邮件发送成功后，会出现“邮件已发送”的弹窗。 \n\n \n3. 考生确认推荐信上传状态在院系报名时间截止前， 考生须登录报名网站确认专家推荐信是否成功上传。若未上传， 考生应提醒推荐专家在报名时间截止前填写并上传推荐信。 \n \n \n4. 保存和邮寄推荐信原件除上传电子版推荐信外， 考生还须妥善保存推荐信原件 （须由推荐专家密封并在封口骑缝处签字） ，按照报考院系的“申请-考核” 制招生说明要求将推荐信原件寄 （送） 达至院系。 \n",
 "body_len": 507,
 "attachments": [
  {
   "name": "20261020091156436628.pdf",
   "url": "https://admission.pku.edu.cn/docs/20261020091156436628.pdf",
   "parsed": true,
   "kind": "file",
   "text_len": 507,
   "note": null
  }
 ],
 "deadline": null,
 "target_year": null,
 "degree_types": [
  "博士"
 ],
 "apply_mode": null,
 "majors": [],
 "materials": [
  "推荐信",
  "专家推荐"
 ],
 "contact": {
  "email": null,
  "phone": null
 },
 "tags": [],
 "extract": {
  "method": "rule",
  "version": "v6",
  "confidence": 0.33
 },
 "crawled_at": "2026-10-20T16:26:58",
 "content_hash": "sha1:1539c863f4d54ff93bc07fa89ea7d3fc02c91e61",
 "relevance": 2,
 "body_how": "file",
 "field_state": {
  "deadline": "absent",
  "majors": "absent",
  "materials": "found",
  "contact": "absent",
  "attachments": "found",
  "body": "ok"
 },
 "record_quality": "ok",
 "quality_hits": [],
 "title_source": "detail",
 "topic": "apply",
 "topic_hits": [
  "报名",
  "报考"
 ],
 "is_fresh": true,
 "age_days": 0,
 "admission_year": null,
 "notice_kind": "announcement",
 "kind_hits": [
  "考核"
 ],
 "age_tier": "live"
}